Company,Date,Title,Abstract,sentiment,sentiment_category,sentiment_abstract,sentiment_category_abstract
Intel,2015-01-07,daily report: intel pledges $300 million to increase diversity in tech industry,the fund is intended to help attract more women and minorities to the technology field and make it more hospitable to them once they get there.,0.3182,Positive,0.6369,Very Positive
Intel,2014-12-02,protecting data privacy at school and at play,"with the growing use of mobile devices in school, and with advertisers compiling data on children's web activities, what can parents do to stop unwelcome tracking?",0.34,Positive,-0.4939,Negative
Intel,2014-10-08,fashion and functionality meet in smart jewelry,"manufacturers are teaming up with designers to produce stylish bracelets, rings and cuff links that are also tech devices.",0.4019,Positive,0.0,Neutral
Intel,2014-08-03,"cloud revenue jumps, led by microsoft and ibm","titans from earlier heydays of computing have both seen recent increases that outstripped the cloud-computing industry generally, according to industry reports.",0.0,Neutral,0.0,Neutral
Intel,2014-06-18,intel introduces custom cloud chip,"as cloud computing gets bigger, some applications have to run on thousands of computer servers at once. intel on wednesday offered a way to tailor its server chip for this work.",0.0,Neutral,0.0,Neutral
Intel,2014-05-12,plaintiff in silicon valley hiring suit maligns deal,"michael devine, one of four plaintiffs named in the class action against apple, google, intel and adobe, has asked the judge in the case to reject the settlement his own lawyers negotiated.",0.0,Neutral,-0.4019,Negative
Intel,2014-04-07,the big data challenge to legacy data management companies,the challenge of big data software tools to traditional data software companies is not that the new technology will be a direct replacement for the old.,0.0772,Neutral,0.0772,Neutral
Intel,2014-02-28,engineers allege hiring collusion in silicon valley,"a class-action suit by silicon valley engineers against companies including google, apple and intel has revealed details of an agreement among them not to cold-call one another's employees.",0.0,Neutral,0.4939,Positive
Intel,2014-01-28,"as facebook turns 10, zuckerberg wants to change how tech industry works","a facebook-sponsored, open-source software group met at the san jose convention center tuesday, and the facebook chief executive made an unscheduled appearance. among his geeky tribe, he gave an uncharacteristically clear sense of his ambitions. and you already thought they were big.",0.0,Neutral,0.25,Positive
Intel,2014-01-10,daily report: seeking new ways to make computer chips,scientists are looking for new ways to make computer chips and investigating materials that can self-assemble.,0.0,Neutral,0.0,Neutral
Intel,2013-12-18,new 49ers stadium will be built with intel guts,"intel said wednesday it would provide advanced technology for a new stadium being built for the 49ers in santa clara, a city 45 miles south of san francisco that is also the company's headquarters.",0.0,Neutral,0.25,Positive
Intel,2013-10-23,longing for the 'wow' at apple's product showcases,apple's keynote presentations were once the most exciting events in the tech industry. now they feel repetitive and boring.,-0.0258,Neutral,0.0498,Neutral
Intel,2013-09-10,intel's extensive makeover,"in a low-key way, the world's largest maker of semiconductors just bid goodbye to the world of pcs and servers, and made a real bid for the cloud. in an exclusive interview, intel's president talks about intel's cultural transformation, which includes help from google and facebook.",0.0,Neutral,0.4939,Positive
Intel,2013-07-28,pc industry fights to adapt as tablets muscle in,"while sales of pcs to businesses remain steady, demand among consumers has plunged, largely because people are instead buying ipads, kindle fires and other tablets.",-0.4019,Negative,-0.128,Neutral
Intel,2013-06-28,"today's scuttlebot: celebrating orwell's '1984,' and uber in taipei","the technology reporters and editors of the new york times scour the web for important and peculiar items. friday's selections include a dutch group decorating surveillance cameras in utrecht in honor of george orwell's 110th birthday, and a taxi app opens for business in taiwan's capital.",0.5719,Positive,0.6808,Very Positive
Intel,2013-06-07,h.p. explains its computing shotgun,"hewlett-packard has prided itself on the cost advantages it gets from running the biggest supply systems in tech. from the way top executives are talking though, that supply chain is about creating lots of products fast. it reflects the market, but means there's more to manage.",0.0,Neutral,0.4118,Positive
Intel,2013-05-03,daily report: intel chief sees many more devices and connections,"brian krzanich takes over a company dominant in pc chips but lagging in making chips for hot products like smart phones and tablets, quentin hardy reports in the new york times.",0.0,Neutral,0.8271,Very Positive
Johnson & Johnson,2016-12-14,yahoo says 1 billion user accounts were hacked,the company says the attack was separate from the breach that led to an earlier disclosure that 500 million accounts were hacked.,-0.4019,Negative,-0.7003,Very Negative
Johnson & Johnson,2016-10-26,your phone can help you get fit,apps that focus on running and other exercises can help you reach your fitness goals.,0.6369,Very Positive,0.5994,Positive
Johnson & Johnson,2016-05-16,"twitter appoints debra lee, adding diversity to its board","ms. lee is the first african-american director at twitter, which been criticized for a lack of representation of varied ethnic groups.",0.0,Neutral,-0.5859,Negative
Johnson & Johnson,2015-08-06,"ibm adds medical images to watson, buying merge healthcare for $1 billion",the company is investing not only money but also some of its corporate reputation on the belief that it can be a technological leader in improving health care.,0.0,Neutral,0.8402,Very Positive
Johnson & Johnson,2015-02-27,mutual suspicion mars tech trade with china,"with china and the united states wary of the other's digital espionage, american tech companies are caught in the middle.",-0.3818,Negative,0.4215,Positive
Johnson & Johnson,2014-06-24,directv and at&t make case to congress,"back-to-back hearings in the house and senate heard from company executives who said a merger could lower cable prices, as well as opponents of the deal.",0.0,Neutral,-0.0258,Neutral
Johnson & Johnson,2014-01-31,gopro goes amateur,the camera company is shifting from exclusively building hardware to focusing more on distributing the media that its cameras create.,0.0,Neutral,0.2732,Positive
Johnson & Johnson,2013-07-05,the price of amazon,bookselling was once a local business. now amazon has a larger market share of new and used printed books than any company has ever. that gives it extraordinary power.,0.1779,Neutral,0.4404,Positive
Johnson & Johnson,2013-03-02,"stand up and cheer, but hit 'pause' first","at some sports arenas, fans can now receive multiple video feeds of the action on their smartphones. but what does that do to the communal enjoyment of a live event?",0.2846,Positive,0.7096,Very Positive
Johnson & Johnson,2012-07-05,apple's retail expansion falls short in china,the shortage of retail stores and authorized resellers leaves room for unlicensed resellers. bad experiences at unauthorized shops run the risk of eroding confidence in apple's products.,0.0,Neutral,-0.5106,Negative
Johnson & Johnson,2012-01-26,today's scuttlebot: tales of kim dotcom and the iphone makers,"the technology reporters and editors of the new york times scour the web for important and peculiar items. thursday's selection includes items on the life of the founder of megaupload, a new iphone 5 rumor and the creator of the apple stores unveiling his vision for j. c. penney.",0.0,Neutral,0.5267,Positive
Johnson & Johnson,2011-08-25,"big shoes at apple, but maybe not unfillable","as timothy d. cook takes over as apple's chief executive, followers of the company wonder how he will react to the spotlight and the scrutiny.",0.0,Neutral,0.0,Neutral
Johnson & Johnson,2011-05-02,sony declines to testify at congressional hearing,sony on monday declined to testify at a congressional hearing on data breaches and their affect on consumers. an earlier deadline has been placed on sony to answer questions about its servers being hacked last week.,0.0,Neutral,-0.4019,Negative
Johnson & Johnson,2010-09-29,the social network that gets down to business,linkedin allows its 75 million users to network with other professionals to find jobs or help build their businesses.,0.0,Neutral,0.4019,Positive
Johnson & Johnson,2010-04-02,will the ipad cause the end of innovation?,a debate in tech circles questions whether apple's ipad is a good or bad thing for the development of innovative software.,0.3818,Positive,0.3182,Positive
Johnson & Johnson,2009-09-17,text-to-speech technology reaches an inflection point,a flood of new devices and software has made text-to-speech technology cheaper and more accessible to those with speech impairments.,0.0516,Neutral,0.0,Neutral
Johnson & Johnson,2009-06-05,venture capital's elders say think small,some venture capitalists who have been investing since the 1960s say the v.c. industry has grown much too big.,0.0,Neutral,0.0,Neutral
Johnson & Johnson,2008-05-20,former aol executives sued in ad-revenue case,the s.e.c. filed fraud charges against eight former aol executives over an accounting procedure that caused the company to overstate its advertising revenue by more than $1 billion.,0.0,Neutral,-0.7096,Very Negative
Johnson & Johnson,2008-02-01,microsoft is building a spaceship out of spare parts,"for microsoft, trying to build a new internet portal-search engine-advertising network-cloud computing company will be trying to make a new interplanetary spaceship out of an old soyuz capsule and spacelab while hurtling through the ether.",0.0,Neutral,-0.34,Negative
Johnson & Johnson,2006-09-27,"more travelers, still at home, meeting online","new online services are giving travelers more places to find road-trip companions, or just pointers for finding local favorites.",0.0,Neutral,0.6369,Very Positive
JPMorgan Chase,2015-12-03,"number26, german banking start-up, expands across europe",the rise of new banking-focused start-ups like number26 is forcing traditional players like deutsche bank and jpmorgan chase to respond to people's desire to access financial services through their smartphones.,0.1027,Neutral,0.7717,Very Positive
JPMorgan Chase,2015-03-27,slack gets hacked as start-up technologies become targets,"communications start-up slack gets hacked, just days after twitch discloses a similar incident.",-0.4019,Negative,-0.4019,Negative
JPMorgan Chase,2014-08-28,daily report: jpmorgan and other u.s. banks are hit by hackers,"in a sophisticated cyberattack, the hackers infiltrated the banks' networks, siphoning off gigabytes of data, including checking and savings account information.",0.0,Neutral,0.5574,Positive
JPMorgan Chase,2014-01-05,ireland stirs homegrown flavor into tech scene,irish officials are using grants and tax breaks to help small start-ups find room among the silicon valley giants that employ thousands in dublin.,0.0,Neutral,0.5574,Positive
JPMorgan Chase,2013-03-13,obama discusses computer security with corporate chiefs,president obama is looking for support as he presses for legislation that would give the administration new technological tools and broader authority in the battle against computer attacks.,0.34,Positive,-0.3612,Negative
JPMorgan Chase,2012-02-12,start-ups seek to help users put a price on their personal data,"personal data management has none of the obvious appeal of social networks or smartphones, but concerns about privacy may be changing that.",0.4019,Positive,0.0,Neutral
JPMorgan Chase,2011-03-23,swiping is the easy part,"with cellphones ready to act as credit cards, banks, carriers and card issuers are fighting for control.",0.4404,Positive,0.3818,Positive
JPMorgan Chase,2007-07-24,h.p. making 2 purchases to push data,"hewlett-packard said it had agreed to pay $1.6 billion for software maker opsware, giving a hefty payoff to opsware founder, marc andreessen.",0.0,Neutral,0.4767,Positive
JPMorgan Chase,2008-02-02,bullish about the web,a january report by jpmorgan chase said growing revenues from online advertising would in part lead to a great year for internet stocks.,0.0,Neutral,0.7003,Very Positive
McDonald's,2016-12-18,a world of surveillance doesn't always help to catch a thief,"a reporter's credit card was stolen, so he counted all the video cameras in stores where it was used afterward. and then he included the data from the uber rides.",-0.6866,Very Negative,-0.1531,Neutral
McDonald's,2016-10-30,the stakes are rising in google's antitrust fight with europe,"the search giant is fighting three antitrust charges, and the results will have a major impact on both the tech company and european policy makers.",-0.3818,Negative,-0.5574,Negative
McDonald's,2015-09-05,mike and quentin's week in tech: amazon's offline game changer,the online marketplace will now allow its prime members to download some movies and tv shows to ios and android devices to watch programming offline.,-0.128,Neutral,0.1027,Neutral
McDonald's,2014-10-28,"apple pay already a huge hit, cook says","at a tech conference in california, timothy d. cook, apple's chief executive, said that one million credit cards had been activated on apple pay in the first three days that the mobile payment system was live.",0.2263,Positive,0.296,Positive
McDonald's,2013-10-23,london's tech city takes root,"the british capital's growing credibility in the tech scene has attracted companies to east london -- or tech city, as some local politicians call the area.",0.0,Neutral,0.5423,Positive
McDonald's,2012-10-04,a billion users raise stakes at facebook for revenue,"facebook announced that it was the first social network to reach one billion active users on the site. although a few companies can claim to have had more than a billion customers, facebook is the first social network to hit that number.",0.0,Neutral,0.4767,Positive
McDonald's,2012-04-15,"disruptions: innovation isn't easy, especially midstream","why could a small start-up build instagram, a photo app, and sell it for $1 billion while companies like eastman kodak, steeped in photography and the emotionalism of photography, could not? culture got in the way.",-0.2973,Negative,0.3612,Positive
McDonald's,2011-04-20,mcdonald's makes subtle play for children online,a virtual world created by mcdonald's shows how food companies aim to keep children on their web sites for long periods of time.,0.34,Positive,0.25,Positive
McDonald's,2010-07-01,an explosion of samsung galaxies,"samsung's galaxy s phones, with their startlingly bright screens and speedy processors, are so impressive that all four major networks -- at&t, sprint, t-mobile and verizon -- will offer a version.",0.0,Neutral,0.7809,Very Positive
McDonald's,2009-07-29,advertisers welcome microsoft-yahoo search deal,advertising-industry leaders say they are happy to see a stronger alternative to google in the internet search market.,0.4588,Positive,0.743,Very Positive
McDonald's,2008-12-05,"one billion mice, and counting","the computer mouse is 40 years old, but touchscreens may lead to its demise.",0.0,Neutral,0.0,Neutral
McDonald's,2008-05-24,shoe seller's secret of success,"in an age of clueless, surly or impossible-to-reach customer service personnel, zappos's fanaticism helps it stand out. it is all in the hiring.",0.5719,Positive,0.0258,Neutral
McDonald's,2007-10-28,making fast food even faster,"restaurants often don't embrace new technology, but interest is now growing in computer systems and web services.",0.0,Neutral,0.6777,Very Positive
McDonald's,2006-01-25,finding new connections when wi-fi is not enough,"the spread of wi-fi, the wireless protocol that has fueled the growth in internet access from coffee shops to mcdonald's to your local library, has sown the seeds of its own obsolescence.",0.0,Neutral,0.3818,Positive
Merck,2015-06-22,data mining start-up enigma to expand commercial business,"after preparing open data for civic-minded projects, the company hopes to interest corporate clients in the insights that can come from public data sets.",0.3182,Positive,0.7003,Very Positive
Merck,2012-07-19,former clinton adviser joins microsoft,"mark penn, a former strategic adviser to bill and hillary clinton, will now work for a new boss: steve ballmer, the chief executive of microsoft.",0.0,Neutral,0.0,Neutral
Microsoft,2016-12-30,back up your itunes collection -- or your whole computer,"saving a copy of your itunes library can be as easy as dragging a folder to an external drive, but there are other ways to make sure you're backed up.",0.0,Neutral,0.6187,Very Positive
Microsoft,2016-12-25,why the computing cloud will keep growing and growing,the rapid expansion of internet-connected devices will put even more power in the hands of a few companies with the biggest cloud services.,0.34,Positive,0.0,Neutral
Microsoft,2016-12-13,"the twitter post, take 2","the popular service currently doesn't let you edit your thoughts after you post them, but some apps can help you make corrections more quickly.",0.0,Neutral,0.6652,Very Positive
Microsoft,2016-12-06,instagram introduces new tools meant to curb abuse and expand privacy,instagram users will soon be able to remove comments and filter out certain followers.,-0.4404,Negative,0.2732,Positive
Microsoft,2016-11-20,microsoft spends big to build a computer out of science fiction,"the computer giant says it's ready to start planning a prototype quantum computer, a superpowerful device that relies on subatomic particles instead of transistors.",0.0,Neutral,0.3612,Positive
Microsoft,2016-11-05,farhad's and mike's week in tech: gaming as prophylaxis to elections,"mike is a medieval witch hunter, as farhad retreats into mario. microsoft's grab for slack's lunch is discussed. and amazon could do better at inspiring shopping.",0.0,Neutral,0.5994,Positive
Microsoft,2016-10-26,microsoft unveils its first desktop pc,the surface studio represents microsoft's growing presence in the hardware side of the industry that it once left entirely to its partners.,0.0,Neutral,0.1779,Neutral
Microsoft,2016-10-18,google pixel review: assessing the new smartphone,"the pixel, which uses android software and assistant, an a.i. virtual assistant, is, relatively speaking, mediocre, but fans of android won't regret buying one.",0.0,Neutral,0.4585,Positive
Microsoft,2016-10-06,daily report: the feds can't resist silicon valley's data,"they also don't want anyone to talk about it, a fact that has riled a number of tech companies that are chafing under gag orders.",0.0,Neutral,-0.323,Negative
Microsoft,2016-09-28,protecting humans and jobs from robots is 5 tech giants' goal,"the partnership on ai unites amazon, facebook, google, ibm and microsoft to ease public fears of machines that are learning to think for themselves.",0.0,Neutral,0.1027,Neutral
Microsoft,2016-09-15,daily report: video is everywhere and regulators have noticed,"as company after company explains its connection to internet video, officials want europe to be viewed as one giant audience.",0.0,Neutral,0.0772,Neutral
Microsoft,2016-09-07,iphone 7 and wireless headphones: analyzing apple's announcements,"as the company updates its most popular product, apple removed a familiar feature: the headphone jack.",0.0,Neutral,0.4754,Positive
Microsoft,2016-08-10,off to college? maybe these devices should go along,"from computers to coffee makers, choosing the right devices for students can be tough. here's a guide to make back-to-school shopping a little easier.",0.0,Neutral,0.2516,Positive
Microsoft,2016-07-29,gathering cloud-computing,"oracle's announced purchase of netsuite is aimed at getting deeper into the game, while amazon drew more than half its operating earnings from the segment.",0.0,Neutral,0.1779,Neutral
Microsoft,2016-07-20,peter thiel's embrace of trump has silicon valley squirming,a speech by the billionaire co-founder of paypal at the republican convention could spoil a delicate but growing relationship between tech and the g.o.p.,0.3182,Positive,0.2846,Positive
Microsoft,2016-07-15,"nintendo to re-release nes games, no blowing necessary","a mini-replica of the original nes console will be available in november, preloaded with 30 games, the company announced.",-0.296,Negative,0.3182,Positive
Microsoft,2016-06-28,downloading video streams to go,some streaming services now allow temporary downloads of certain videos to watch when you do not have internet access.,0.0,Neutral,0.4588,Positive
Microsoft,2016-06-16,unhitching the pc from onedrive,"microsoft's online file-storage service is there to copy your files to the cloud, but you can decline the offer.",0.0,Neutral,0.0,Neutral
Microsoft,2016-06-08,"e3, fading catnip for video gamers, tries a new approach","e3 has lost some industry participants in what was once a premier event, but it is adjusting its lineup and adding an event for gamers.",0.0,Neutral,-0.1655,Neutral
Microsoft,2016-05-25,"microsoft cutting 1,850 jobs in smartphone unit","as sales dwindle, most of the reduction will come in finland, where the mobile business bought from nokia originated.",-0.128,Neutral,0.0,Neutral
Microsoft,2016-05-17,china's new requirement for u.s. tech companies,"the reviews, which require company employees to appear in person, involve consumer software and mainstream devices and look at encryption or data storage.",0.0,Neutral,0.0,Neutral
Microsoft,2016-05-04,restoring windows photo viewer in windows 10,"microsoft's older program for displaying images has been replaced with the new photos app, but you have alternatives.",0.296,Positive,0.0,Neutral
Microsoft,2016-04-23,farhad and mike's week in tech: to be or not to be an uber employee,the tentative uber settlement leaves unresolved the dispute over the company's practice of keeping its drivers as contractors instead of employees.,0.0,Neutral,-0.4019,Negative
Microsoft,2016-04-20,e.u. charges dispute google's claims that android is open to all,"europe's competition chief said google unfairly promoted its services with cellphone makers, limiting rivals in the smartphone software market.",-0.5859,Negative,0.4215,Positive
Microsoft,2016-04-14,microsoft sues justice department to protest electronic gag order statute,the company is challenging the use of secrecy orders that prevent it from telling people when the government obtains a warrant to read their emails.,0.0,Neutral,0.1779,Neutral
Microsoft,2016-04-04,adding links to the windows 10 start menu,"if you miss some of the handy shortcuts from earlier versions of windows, you can easily add them.",0.0,Neutral,0.2023,Positive
Microsoft,2016-03-27,american tech giants face fight in europe over encrypted data,"as apple battles the f.b.i. over ""unlocking"" an iphone, european governments are pushing for greater access to people's digital lives.",-0.3818,Negative,-0.0258,Neutral
Microsoft,2016-03-22,crowdsignals aims to create a marketplace for smartphone sensor data,"a new project seeks to collect, label and pay for mobile sensor data and encourage innovation in many fields.",0.2732,Positive,0.6705,Very Positive
Microsoft,2016-03-07,microsoft to close 2 game development studios,"the studios are lionhead, which is based in britain, and press play, which is based in denmark.",0.0,Neutral,0.34,Positive
Microsoft,2016-03-01,keeping track of windows updates,you can see what software and security patches microsoft has pushed out to your pc by looking in the windows update history.,0.0,Neutral,0.34,Positive
Microsoft,2016-02-24,u.s. asks tech and entertainment industries help in fighting terrorism,the white house summoned executives from social media and entertainment to washington for talks on countering recruiting efforts by extremists.,-0.3818,Negative,0.4215,Positive
Microsoft,2016-02-17,apple's stance highlights a more confrontational tech industry,the battle between apple and law enforcement officials over a terrorist's cellphone is heading toward an eventual victory for tech companies.,-0.4391,Negative,-0.3818,Negative
Microsoft,2016-02-03,how to watch the super bowl when you don't have cable,a variety of easy -- and legitimate -- ways are now available for watching the biggest football game of the year.,0.5994,Positive,0.4404,Positive
Microsoft,2016-01-29,replacing windows media center,"microsoft has retired the windows media center software, but other programs can manage your music, movies and photos in windows 10.",0.0,Neutral,0.0,Neutral
Nike,2016-12-06,supreme court gives samsung a reprieve in apple patent case,a unanimous court ruled on tuesday that samsung may not have to pay $399 million in damages for copying parts of the iphone's distinctive look.,0.5574,Positive,-0.3826,Negative
Nike,2015-03-18,video feature: design gains importance as devices get more personal,"experts say it's not enough for a smartphone or other gadget to have all the software bells and whistles, it must also look and feel good.",0.5994,Positive,0.4404,Positive
Nike,2014-06-18,fitness devices that do (just) a bit more,"new wearable devices track activities, vital statistics and then some, in combination with apps. but is it enough to justify their price?",0.2732,Positive,0.1531,Neutral
Nike,2014-02-18,is instagram another path to riches for facebook?,"the photo- and video-sharing service offers a powerful way for fashion, retail and travel brands to connect with customers, according to a new research report.",0.5267,Positive,0.4215,Positive
