Company,Date,Title,Abstract,sentiment,sentiment_category,sentiment_abstract,sentiment_category_abstract
3M,2015-04-07,hp comes to terms with the cloud,"hewlett-packard has decided it cannot compete with the likes of amazon and google for one of the hottest new businesses. instead, on the eve of its split into two companies, hp is learning about collaborative technologies, and not just for its customers.",0.0,Neutral,0.5423,Positive
3M,2013-03-21,addressing fears about led light bulbs,"a column about led light bulbs generated a lot of reader e-mail, probably because led represents change. and change is always scary. david pogue addresses some reader concerns.",-0.4215,Negative,-0.4939,Negative
3M,2010-04-18,companies slowly join cloud-computing,"amazon, microsoft, google and others are now trying to rent large corporations the remote use of their technology infrastructure, but some concerns remain after a few cautious steps into cloud services.",0.296,Positive,-0.0644,Neutral
3M,2008-12-26,electric-car battery makers seek federal funds,an alliance of big companies and start-ups wants congress to give it at least $1 billion to support u.s. lithium-ion battery production for electric cars.,0.0,Neutral,0.4019,Positive
3M,2006-08-22,web surfing in public places is a way to court trouble,"any business traveler who has logged on to a wireless network at the airport or checked e-mail at a public terminal has probably wondered, ""is this safe?""",-0.4019,Negative,0.0,Neutral
American Express,2016-12-14,twitter has the right to suspend donald trump. but it shouldn't.,the president-elect's tweets are arguably inciting harassment against his critics. but twitter's conduct rules are too vague to merit banning mr. trump.,-0.1655,Neutral,-0.0644,Neutral
American Express,2016-11-16,social media's globe-shaking power,the election of donald j. trump is perhaps the starkest illustration yet that social networks are helping to rewire human society.,0.0,Neutral,0.296,Positive
American Express,2016-07-12,where pokemon should not go,the digital beasts have been reported at auschwitz and memorials for the holocaust and the sept. 11 attacks.,0.0,Neutral,-0.4404,Negative
American Express,2016-05-18,"twitter, trump's trusty weapon, could backfire","the social media platform has served mr. trump's bombast and provocations well, but such behavior may be poison to a general election campaign.",0.25,Positive,-0.6369,Very Negative
American Express,2016-02-18,public split between concern over terrorism and privacy,"a survey found that 54 percent of the public said they were very or somewhat concerned about the loss of privacy, while 44 percent were not very concerned or not at all concerned.",-0.6808,Very Negative,-0.3182,Negative
American Express,2015-12-10,mark zuckerberg of facebook reassures muslim users,mr. zuckerberg's new openness on social media has met up with business considerations.,0.3612,Positive,0.34,Positive
American Express,2015-08-03,"for mobile messaging, gifs prove to be worth at least a thousand words","animated, looping images are experiencing a surge on mobile devices, growing an industry and providing textless messages for millions of users.",0.2263,Positive,0.1779,Neutral
American Express,2015-05-28,a primer on android pay and google wallet,here is how google's new mobile payments products -- android pay and google wallet -- are set to work.,-0.1027,Neutral,-0.1027,Neutral
American Express,2015-01-23,"sony postpones earnings announcement, blaming hacking attacks","the company said it would delay a quarterly earnings report as a result of disruptions to the computer network at its american film studio, sony pictures entertainment.",-0.802,Very Negative,-0.2263,Negative
American Express,2014-09-17,let the phone be your political adviser,"mobile apps offer news and opinion on politicians and issues, and even information straight from congress and the white house.",0.0,Neutral,0.2263,Positive
American Express,2014-08-20,nickel allergies on rise as devices meet skin,"some consumers are finding that their electronic devices cause allergic reactions, a problem that is increasing as the devices become wearable.",0.0,Neutral,-0.5994,Negative
American Express,2014-06-06,vodafone reveals direct access by governments to customer data,"in a privacy report, the british telecommunications company said that the authorities in certain countries had direct access to its networks without having to use legal warrants.",0.0,Neutral,0.3818,Positive
American Express,2014-04-02,blackberry breaks up with t-mobile,"weeks after a public spat between the two companies' chief executives, blackberry said that it would not allow t-mobile us to sell blackberry phones after april 25.",0.0,Neutral,-0.1695,Neutral
American Express,2014-01-30,a case for cheaper broadband in schools,are america's schools getting a bad deal from government broadband regulation? a group of chief executives and venture capitalists is telling the f.,0.0,Neutral,-0.5423,Negative
American Express,2013-10-08,"encouraging the reviewers, honestly",american express and tripadvisor introduce a new program to make online reviews a bit more transparent.,0.7506,Very Positive,0.0,Neutral
American Express,2013-08-09,trade commission orders ban on some samsung products,"the international trade commission upheld a preliminary finding that samsung's mobile products had violated two apple patents. the decision, unless vetoed by president obama, will result in an import ban on some devices.",-0.5574,Negative,-0.7906,Very Negative
American Express,2013-04-15,'lean in' software goes corporate,"the nonprofit financed by sheryl sandberg to get more women in positions of power uses a novel social networking software to create small groups with a common purpose. on tuesday, that software will be offered more broadly.",0.0,Neutral,0.5267,Positive
American Express,2013-02-01,the origins of 'big data': an etymological detective story,"tracing the origins of the term ""big data"" shows how digital technology is changing the way words and ideas develop and spread, and how they are studied.",0.0,Neutral,0.0,Neutral
American Express,2012-10-05,nokia's new lumia is an at&t exclusive again,"nokia's new flagship smartphone, the lumia 920, will will be sold next month in the united states only in at&t stores. this story is familiar: last time, at&t was the only american carrier to support nokia's older flagship lumia, which didn't sell well. so why does at&t keep getting the goods?",0.128,Neutral,0.669,Very Positive
American Express,2012-06-07,"rather than share your location, foursquare wants to suggest one","foursquare, a start-up whose app lets users share their locations, has seen its growth slow, and its founders hope that suggesting places to users could change that.",0.296,Positive,0.7717,Very Positive
American Express,2012-02-13,google deal for motorola mobility gets clearance,the justice department approval came hours after the european union imposed no conditions on the acquisition.,0.0,Neutral,0.6124,Very Positive
American Express,2011-12-04,steering telecom italia with a steady hand,"franco bernabe, the chief executive, is giving the once trend-setting mobile operator something to cheer about as it starts to make inroads in new markets.",0.4939,Positive,0.6908,Very Positive
American Express,2011-07-20,social media history becomes a new job hurdle,"a start-up helps companies dig into potential employees' activity online, from facebook posts to e-commerce usage.",0.0,Neutral,0.3818,Positive
American Express,2011-04-27,india puts tight leash on internet free speech,new rules allow anyone to demand that web sites and service providers remove content considered objectionable.,0.5106,Positive,0.1027,Neutral
American Express,2010-12-02,"legislators support internet privacy, but question how to achieve it",the federal trade commission says that so far it has seen no negative effect on advertising from stricter internet privacy.,0.2144,Positive,-0.7096,Very Negative
American Express,2010-07-15,"at snopes.com, rumors are held up to the light","david pogue interviews david mikkelson of snopes.com, where internet veterans go to get the truth about online rumors.",0.0,Neutral,0.3182,Positive
American Express,2010-02-16,a conference keen on finding open communication,experts say the state of play for apps is a cacophony of incompatible software that threatens to slow the growth of the mobile internet.,0.3612,Positive,0.34,Positive
American Express,2009-07-29,advertisers welcome microsoft-yahoo search deal,advertising-industry leaders say they are happy to see a stronger alternative to google in the internet search market.,0.4588,Positive,0.743,Very Positive
American Express,2009-04-19,italians look to small screen,several of italy's best-known directors have turned their lenses to making short movies for the internet.,0.0,Neutral,0.0,Neutral
American Express,2009-01-20,credit card processor says some data was stolen,"heartland payment systems said the system it used to process visa, mastercard, american express and discover card transactions was breached last year.",-0.1531,Neutral,0.0,Neutral
American Express,2008-08-11,global trail of an online crime ring,prosecutors say their own informant stole millions of credit card numbers in a case that reveals how the internet is enabling new crimes on a vast scale.,-0.5423,Negative,0.3818,Positive
Amgen,2010-03-20,would you pay $20 for access to a breast cancer cure?,"a canadian organization has started a biotech cooperative, financed by sales of $20 shares, to develop personalized therapies for breast cancer.",-0.7003,Very Negative,-0.4939,Negative
Amgen,2008-09-16,"in an unsettled market, a biotech company called fluidigm is about to go public","fluidigm's offering, which it hopes to make on thursday unless market conditions force it to withdraw, is underwritten by morgan stanley.",-0.3182,Negative,0.4215,Positive
Apple,2016-12-30,back up your itunes collection -- or your whole computer,"saving a copy of your itunes library can be as easy as dragging a folder to an external drive, but there are other ways to make sure you're backed up.",0.0,Neutral,0.6187,Very Positive
Apple,2016-12-28,five resolutions to simplify your tech life,"follow these tips to improve the maintenance of your passwords, devices and tech infrastructure. also, shop smarter and reduce waste in 2017.",0.0,Neutral,0.4767,Positive
Apple,2016-12-14,2016 in review: the year's best apps,"a news curator based on what friends are reading, an easy-to-access universe of npr audio, and an upgraded beer-tracking app are among our top picks.",0.6369,Very Positive,0.5994,Positive
Apple,2016-12-08,"with linkedin, microsoft looks to avoid past acquisition busts",the technology giant has not had a great track record with the companies it acquires. the hope is that it has learned from its mistakes.,-0.296,Negative,-0.4393,Negative
Apple,2016-12-03,farhad's and mike's week in tech: more debate over facebook's role in media,questions continue to swirl over facebook's handling of fake news stories and a tool it created that could potentially be used to censor content in china.,0.0,Neutral,-0.6249,Very Negative
Apple,2016-11-20,"how apple empowers, and employs, the american working class","the tech giant probably won't bring all production to the united states, as donald trump has suggested, but it provides diverse opportunities for thousands of americans, along with a ladder to climb.",0.0,Neutral,0.6486,Very Positive
Apple,2016-11-07,daily report: more fake retail apps means more users are at risk,"consumers may be deceived into entering their credit card numbers into counterfeit applications, often disguised as bona fide programs.",-0.6697,Very Negative,-0.34,Negative
Apple,2016-10-31,daily report: google's day in europe's court highlights nature of new tech,the search giant is one of several american tech companies facing inspections overseas for the way they do business.,0.0,Neutral,0.0,Neutral
Apple,2016-10-25,"apple predicts a big holiday bounce after its biggest rival, samsung, falters","if the company's forecast is accurate, it will mark a turnaround from what has been a disappointing year for the silicon valley giant.",0.4019,Positive,-0.4939,Negative
Apple,2016-10-15,"jim's and nick's week in tech: smoldering phones, the yahoo markdown and amazon music","sometimes people forget that old guys can be geeks. this week: how samsung helped apple, will verizon win a discount, and a new riff on a classic excuse.",0.1779,Neutral,0.4215,Positive
Apple,2016-10-05,twitter's fate: marc benioff of salesforce addresses acquisition talk,the tech world has been buzzing since it heard that the online software company salesforce was interested in bidding for twitter.,0.0,Neutral,0.4019,Positive
Apple,2016-09-30,a health checkup for your laptop battery,"lithium-ion batteries don't last forever, but there are ways to find out your battery's current condition.",0.0,Neutral,0.0,Neutral
Apple,2016-09-27,make the mac's share menu more useful,"apple's operating system provides an easy menu shortcut for sharing links, photos and other content, and you can customize your list of options.",0.659,Very Positive,0.6908,Very Positive
Apple,2016-09-21,allo's tryout: 5 days with google's annoying office intern,google's new chat app promises to stand out from a crowded field by bringing artificial intelligence into conversations. but it turns out to be frustrating and unhelpful.,-0.4019,Negative,-0.25,Negative
Apple,2016-09-13,"e.u. rules look to unify digital market, but u.s. sees protectionism","the rules will put new pressure on american tech companies, but european officials say they will unite the continent's various national economies.",0.0,Neutral,-0.1531,Neutral
Apple,2016-09-09,how to set up your own podcast recording studio,quality microphones and free recording software can get your personal audio show rolling for less money than you might think.,0.0,Neutral,0.5106,Positive
Apple,2016-09-06,"daily report: iphone season is here, but these days, surprises are rare","for almost a year, apple rumormongers have been trotting out bits and pieces about what to expect from the latest device. and often, these rumors are picked up by mainstream media.",0.3291,Positive,0.0,Neutral
Apple,2016-08-30,fact-checking apple's claims on e.u. tax ruling,the company's chief executive issued a defiant letter after ireland was ordered to collect about $14.5 billion in back taxes.,0.0,Neutral,-0.2263,Negative
Apple,2016-08-26,"cloud computing brings sprawling centers, but few jobs, to small towns","as big companies race to build oversize data networks, communities are finding that the giant buildings can operate with only about 30 people.",0.0,Neutral,0.0,Neutral
Apple,2016-08-17,converting spreadsheets in apple's numbers to excel,"apple's spreadsheet program can edit microsoft excel files, but you need to take an extra step to use those files in excel again.",0.4588,Positive,0.7184,Very Positive
Apple,2016-08-07,amazon has big plans for alexa: running the 'star trek' home,"the tech giant wants to weave its intelligent assistant into other smart gadgets, even those not made by amazon. but weakness in mobile could be an obstacle.",0.1779,Neutral,-0.6552,Very Negative
Apple,2016-07-27,"alexa, what else can you do? getting more from amazon echo","making amazon's voice-activated speaker smarter is not intuitive, but with a little tinkering, consumers can expand its skills.",0.2449,Positive,0.6059,Very Positive
Apple,2016-07-20,what's the right age for a child to get a smartphone?,"as more children get phones at 10 and younger, parents face the question of when to allow unfettered access to the internet and all its benefits and perils.",0.0,Neutral,0.5423,Positive
Apple,2016-07-15,"character, fate and yahoo",forget the years of lousy deals and seedy shenanigans: yahoo's real problem was a contradiction it couldn't resolve.,0.0,Neutral,-0.8829,Very Negative
Apple,2016-07-08,keeping podcasts under control,the ios podcasts app includes management tools to help keep your downloaded audio and video episodes from filling up your iphone.,0.0,Neutral,0.4019,Positive
Apple,2016-06-28,downloading video streams to go,some streaming services now allow temporary downloads of certain videos to watch when you do not have internet access.,0.0,Neutral,0.4588,Positive
Apple,2016-06-18,farhad's and mike's week in tech: that business of microsoft buying linkedin,"farhad and mike try to itemize microsoft's $26.2 billion bill for linkedin. uber's chinese rivalry, apple updates and other tech news.",0.0,Neutral,0.0,Neutral
Apple,2016-06-13,microsoft and apple making headlines,microsoft's planned acquisition of linkedin and apple's developer conference were the talk of tech on monday.,0.0,Neutral,0.0,Neutral
Chevron,2016-08-26,"john ellenby, visionary who helped create early laptop, dies at 75","mr. ellenby founded grid systems, where the compass was produced. it went on to become a tool for big corporations, government spies, white house officials and astronauts.",0.6705,Very Positive,0.0,Neutral
Chevron,2012-10-18,"stanford r. ovshinsky dies at 89, a self-taught maverick in electronics","a self-taught scientist, mr. ovshinsky invented the nickel-metal hybrid battery and contributed to the development of many other devices.",0.0,Neutral,0.0,Neutral
Chevron,2007-03-16,green energy enthusiasts are also betting on fossil fuels,some technology investors that portray themselves as green-friendly are inconsistent with their marketing message.,0.5423,Positive,0.0,Neutral
Chevron,2007-09-06,this just in from 2030: looming war restricts access to oil,chevron has us playing the oil game.,-0.7717,Very Negative,0.2023,Positive
Cisco Systems,2016-12-30,join our board: companies hotly pursue new wave of women in tech,"even in silicon valley, where talent wars are legion, courting female executives to join tech company boards is particularly cutthroat.",0.296,Positive,0.1027,Neutral
Cisco Systems,2016-08-27,"g.e., the 124-year-old software start-up","the industrial giant is investing big in an effort to adopt the nimble habits and digital wizardry of silicon valley. and, its c.e.o. says, there is no plan b.",0.0,Neutral,-0.128,Neutral
Cisco Systems,2016-04-21,apple services shut down in china in startling about-face,"the ibooks store and itunes movies were closed six months after they began in china, which had been more welcoming of apple than other tech companies.",0.0772,Neutral,0.4927,Positive
Cisco Systems,2015-09-16,china tries to extract pledge of compliance from u.s. tech firms,"some have received letters asking for a promise to make their products ""secure and controllable,"" a catchphrase that might mean backdoor access to private information.",0.0,Neutral,0.5719,Positive
Cisco Systems,2015-05-13,cisco's profit and sales beat wall street forecasts,"profit for cisco systems, the networking equipment giant, rose 12 percent, to $2.4 billion, in its fiscal third quarter.",0.4404,Positive,0.4404,Positive
Cisco Systems,2015-01-28,new rules in china upset western tech companies,"stringent regulations, including a requirement to share secret codes, are another form of economic protectionism, western technology companies say.",-0.3818,Negative,0.296,Positive
Cisco Systems,2014-09-29,cisco: the internet needs more control,"cisco has a novel approach for selling its big internet vision, called intercloud: there is no better way to impose government policies on the internet.",0.0,Neutral,0.4215,Positive
Cisco Systems,2014-06-18,facebook makes its own computer networking switch,"the social media giant announced that it had created a new kind of computer networking switch, potentially capable of shifting data rapidly through the largest data centers.",0.0,Neutral,0.5574,Positive
Cisco Systems,2014-04-18,heartbleed highlights a contradiction in the web,the bug that rattled the internet last week exposed the paradox that some of the web's most crucial coding depends on the efforts of volunteers.,-0.25,Negative,-0.1779,Neutral
Cisco Systems,2014-02-12,the number cisco left out,"cisco just reported a tough quarter, the latest sign of an incumbent struggling to adapt to a world of cloud computing, mobility, sensors, and lots of cheap competition.",0.0772,Neutral,-0.5106,Negative
Cisco Systems,2013-12-09,h.p. tying more big-business systems together,the silicon valley giant is embracing the notion that different types of business computing systems are merging into one tightly integrated computing engine.,0.0,Neutral,0.0,Neutral
Cisco Systems,2013-08-21,shifting tech scene unsettles big players,"hewlett-packard, cisco and other companies that once dominated the industry are struggling as users turn to cloud computing services and mobile phones.",0.0,Neutral,-0.4215,Negative
Cisco Systems,2013-05-23,"used computer, $116,000 or best offer","apple-1 computers have sold for hundreds of thousands of dollars in recent auctions, a run-up reflecting the company's mystique.",0.6369,Very Positive,0.0,Neutral
Cisco Systems,2013-04-10,arming cable against the open internet,networking and content management providers are working with cable companies and other broadcasters to deal with competition from the internet by controlling the mobile video experience and offering extras.,0.0,Neutral,0.0,Neutral
Cisco Systems,2013-02-03,"once blackberry focused, a campus widens its view","the university of waterloo, a world-class engineering school in canada, is a feeder campus for big-name global tech companies like blackberry, a neighbor and waterloo offshoot.",0.3818,Positive,0.3612,Positive
Cisco Systems,2012-09-29,meg whitman's toughest campaign: retooling h.p.,the former ebay chief and gubernatorial candidate has found her act iii at hewlett-packard. but the challenge of re-energizing the company for a new information era is daunting.,-0.0772,Neutral,0.1154,Neutral
Cisco Systems,2012-05-23,"as computing changes, hewlett-packard struggles to follow","finding it hard to keep up with radical shifts to new modes of computing, the technology company reported sharply lower net income and confirmed a plan to pare its work force.",-0.3612,Negative,-0.3818,Negative
Cisco Systems,2012-04-10,i.b.m. aims to sharply simplify corporate data center technology,"i.b.m. is introducing bundles of server hardware and software packaged in simplified systems, with setup and maintenance automated by intelligent software.",0.0,Neutral,0.4588,Positive
Cisco Systems,2012-03-04,the bright side of being hacked,one benefit of an attack by a group like anonymous: it can gird a company against more serious online espionage.,0.0516,Neutral,0.204,Positive
Cisco Systems,2011-12-19,the coming war for the social workplace,"cloud computing may be about more than just more efficient and supple software, or mobile systems that allow work from anywhere. to some of the leading companies in the field, it's about a whole new social style of management.",-0.5994,Negative,0.6115,Very Positive
Cisco Systems,2011-10-20,rim faces a naming problem,"rim's new name for its operating system, bbx, is similar to another company's software's name, bbx.",-0.4019,Negative,0.0,Neutral
Cisco Systems,2011-08-23,sell big or die fast,"these days, large technology companies -- particularly those in the hypercompetitive smartphone and tablet industries -- are cutting their losses with increasing speed.",-0.5994,Negative,-0.4939,Negative
Cisco Systems,2011-06-03,at&t races to expand the network,much of the $18 billion at&t will spend this year will be diverted into upgrades and expansions to meet the surging demands on the 3g network.,0.3182,Positive,0.0,Neutral
Cisco Systems,2011-04-17,wreckage at the intersection of corporate and consumer markets,"before it bought (and then decided to close) the maker of flip cameras, cisco must have seen the cautionary tales of failures, but the allure was too strong.",0.0,Neutral,0.5346,Positive
Cisco Systems,2011-02-25,"china telecom giant, thwarted in u.s. deals, seeks inquiry to clear name",the chinese telecommunications group said that its american expansion has been undermined by false allegations that it had ties to chinese authorities.,0.3612,Positive,-0.3612,Negative
Cisco Systems,2010-11-28,"google grows, and works to retain nimble minds","the pace at a big company is far slower than at a start-up, a difference that matters to the entrepreneurial spirit.",0.0,Neutral,0.2023,Positive
Cisco Systems,2010-10-04,"cisco executive is named chief of skype, as new owners build a leadership team",tony bates will assume the top job at skype as its new owners continue to put their stamp on the fast-growing company after buying it from ebay.,0.0,Neutral,0.2023,Positive
Cisco Systems,2010-07-22,the softer side of dell,"when it comes to datacenter wares, a new dell has appeared with a growing arsenal of software products.",0.0,Neutral,0.1779,Neutral
Cisco Systems,2010-04-19,stranded travelers turn to videoconferencing,audio and video conferencing businesses are reporting increases in demand since the volcanic disruptions.,0.0,Neutral,-0.4404,Negative
Cisco Systems,2010-02-10,report warns silicon valley could lose its edge,"unemployment in the area is higher than national levels and the worst since 2005, when tech companies were recovering from the dot-com implosion.",-0.4767,Negative,-0.7906,Very Negative
Cisco Systems,2010-01-13,microsoft and hewlett-packard make a really big deal,microsoft and h.p. have broadened their already broad partnership to sell more technology together.,0.0,Neutral,0.0,Neutral
Coca-Cola,2016-06-19,"airbnb vows to fight racism, but its users can't sue to prompt fairness","airbnb tells users they must agree to waive the right to sue, or to join in any class-action lawsuit or class-action arbitration, as a condition of using the service.",-0.5187,Negative,0.4215,Positive
