Company,Date,Title,Abstract,sentiment,sentiment_category,sentiment_abstract,sentiment_category_abstract
Coca-Cola,2015-10-05,"delegating, jack dorsey will lead twitter and square",mr. dorsey has been aggressively making changes as interim chief since dick costolo stepped down on july 1.,0.0,Neutral,-0.6808,Very Negative
Coca-Cola,2014-08-30,"in e-sports, video gamers draw real crowds and big money",professional video gaming is becoming a worldwide spectator sport offering big prizes to competitors and helping the game industry gain even greater cultural and economic clout.,0.0,Neutral,0.8779,Very Positive
Coca-Cola,2013-10-24,samsung electronics fined for fake online comments,"a taiwanese trade agency has punished samsung electronics for paying people to post fake online comments that mocked its competitor, htc, the struggling handset maker. the south korean manufacturer will have to pay a fine of about $340,000.",-0.4767,Negative,-0.8689,Very Negative
Coca-Cola,2012-11-30,study may offer insight into coca-cola breach,a 2010 case study of a security breach at an unnamed fortune 500 company appears to offers new details of a breach at coca-cola.,0.0,Neutral,0.34,Positive
Coca-Cola,2010-12-15,twitter courts businesses to advertise,"twitter has opened its doors to businesses that want to advertise, as the company focuses on making money after building a huge user base.",0.0,Neutral,0.3818,Positive
Coca-Cola,2008-02-13,yahoo acquires ad technology company,"yahoo said it has paid $160 million to acquire maven networks, an internet company that sells a system for managing advertisements in online videos.",0.0,Neutral,0.0,Neutral
Coca-Cola,2007-11-07,facebook is marketing your brand preferences (with your permission),the social networking site now sells ads that display people's profile photos next to commercial messages that are shown to their friends about items they purchased or registered an opinion about.,0.0,Neutral,0.4767,Positive
Coca-Cola,2006-09-05,"online game, made in u.s., seizes the globe","world of warcraft, with almost seven million paying subscribers, has become the first truly global video-game hit since pac-man in the early 80's.",0.0,Neutral,0.4404,Positive
Coca-Cola,2006-07-10,"shopping by phone, on the move",the september issue of lucky magazine will let readers send text messages from their mobile phones to buy merchandise from 18 marketers and retailers.,0.0,Neutral,0.4215,Positive
Dow Inc.,2016-01-24,looking for signs that apple's runaway growth is waning,"with iphone sales projected to decelerate, investors will be scouring apple's earnings report on tuesday for signs of how fast the company's downshift is happening.",0.3818,Positive,0.0,Neutral
Dow Inc.,2014-01-28,jason calacanis shoots for human moments in news feeds,a rush of new entrants to new media involves people.,0.0,Neutral,0.0,Neutral
Dow Inc.,2010-06-09,at&t is said to have exposed ipad owners' e-mail addresses,"a hacking group obtained the e-mail addresses of 114,000 owners of 3g ipads using a security hole on at&t's web site, gawker reported.",-0.0772,Neutral,0.34,Positive
Dow Inc.,2007-06-06,restitution deal made,a former sales chief at ca inc. has agreed to pay $29.7 million in restitution after pleading guilty last year to criminal charges.,0.0,Neutral,-0.765,Very Negative
Goldman Sachs,2016-11-11,10-second videos from your sunglasses. thank snapchat.,"snap inc., formerly known as snapchat, is hoping its wearable technology can succeed where google glass failed.",0.3612,Positive,0.4019,Positive
Goldman Sachs,2016-05-20,start-ups once showered with cash now have to work for it,"instead of venture capitalists begging to invest in start-ups, entrepreneurs are begging for cash, and potential investors are making demands.",0.0,Neutral,0.0,Neutral
Goldman Sachs,2015-10-05,jack dorsey's dual c.e.o. role raises questions for square,"mr. dorsey becomes chief executive of twitter just as square, which he also heads, is making preparations for an initial public offering.",0.0,Neutral,0.0,Neutral
Goldman Sachs,2015-03-16,uber's chief financial officer to leave company,"brent callinicos, the chief financial officer of uber, plans to leave the ride-sharing company, in what will be one of the highest-level departures yet for the six-year-old start-up.",-0.0516,Neutral,-0.1189,Neutral
Goldman Sachs,2014-10-30,"twitter appoints product chief, replacing one named 6 months ago",twitter said it had picked kevin weil to speed its sluggish efforts to make its social network easier and more compelling for new and old users.,0.0,Neutral,0.3167,Positive
Goldman Sachs,2014-04-12,"a talk with simon head, author of 'mindless: smarter machines are making dumber humans'",mr. head offers his thoughts on the social landscape of the technology-dominated economy.,0.128,Neutral,0.0,Neutral
Goldman Sachs,2013-02-12,apple chief hints at shareholder rewards to come,"investors have been pressing apple to distribute more of its vast cash hoard to its shareholders. timothy d. cook, apple's chief executive, said on tuesday that the company was discussing the problem, suggesting that some kind of payout is likely soon.",0.4767,Positive,-0.4019,Negative
Goldman Sachs,2012-08-02,"sony's quarterly profit sinks, hit by weak demand","pummeled by the slow global economy, exchange rate shifts and the euro zone crisis, sony reported a 77 percent slide in operating profit, far below expectations for the quarter.",-0.128,Neutral,-0.296,Negative
Goldman Sachs,2012-02-13,"apple shares close above $500, breaking more records","on monday, apple reached new heights with its shares closing at $502.60, up $9.18, or 1.86 percent. it was the first time apple's share price had passed $500.",0.296,Positive,0.5859,Positive
Goldman Sachs,2011-10-27,facebook-led consortium plans to remake big computing,"facebook plans to announce creation of a nonprofit foundation to run the open compute project, an effort to encourage collaboration among technology giants on building low-cost computing centers.",0.0,Neutral,0.6597,Very Positive
Goldman Sachs,2011-01-11,hot social networking site cools as facebook grows,"no longer trying to compete with facebook, myspace recently revamped its site to give users more ways to consume music, videos and celebrity gossip.",0.0,Neutral,-0.4404,Negative
Goldman Sachs,2010-04-12,reports that palm is to be sold lift its stock,two people close to the company say it is seeking a buyer after its slick new smartphone failed to make a splash.,0.0,Neutral,-0.5106,Negative
Goldman Sachs,2009-08-09,an online market flourishes in china,"millions of people in china -- recent graduates, shopkeepers and retirees -- are using taobao to sell things like clothes, phones and toys.",0.0,Neutral,0.3612,Positive
Goldman Sachs,2007-12-29,wireless tower operator sues chief of rival,the american tower corporation sued the head of a rival claiming he had impersonated its chief by sending a negative article about it via e-mail to two large investors.,0.0,Neutral,-0.5719,Negative
Goldman Sachs,2007-10-19,google's strong quarter widens gap with rivals,"the search giant's surging third quarter profits showed that it was growing at twice the speed of the online advertising market, which itself is booming.",0.5106,Positive,0.5574,Positive
Goldman Sachs,2007-07-25,oh those analysts,"how close were the analyst's predictions on apple iphone sales? oh, say double the reality.",0.0,Neutral,0.0,Neutral
Goldman Sachs,2007-05-24,"microsoft asks, why buy yahoo?","microsoft said wednesday that it did not need to buy yahoo to gain scale in online advertising, because it had ""all the pieces"" to build a successful ad business.",0.0,Neutral,0.802,Very Positive
Goldman Sachs,2007-05-05,rumors fly on microsoft and yahoo,microsoft and yahoo are discussing a business partnership in their effort to compete with google.,0.0,Neutral,0.0,Neutral
Goldman Sachs,2006-11-22,google's shares climb above $500,"google's shares gained $14.60, or 3 percent, today to close at $509.65, passing the $500 mark for the first time.",0.296,Positive,0.5859,Positive
Goldman Sachs,2006-08-11,"betonsports, after indictment, folds its hand and shifts focus to asia","betonsports told 800 employees in costa rica and antigua, where the virtual casino has its operations, that they would be losing their jobs.",0.4939,Positive,-0.3818,Negative
Goldman Sachs,2006-05-26,google reaches agreement to have its software installed on new dell computers,"the arrangement means that google's search toolbar will appear on the screens of new dell systems, and that dell users will be directed to a web page branded by the two companies.",0.5267,Positive,0.0,Neutral
The Home Depot,2016-08-10,think amazon's drone delivery idea is a gimmick? think again,"amazon doesn't reveal much, but a little sleuthing suggests that drones may be central to the online retailer's long-term strategy.",0.0,Neutral,0.09,Neutral
The Home Depot,2015-03-27,slack gets hacked as start-up technologies become targets,"communications start-up slack gets hacked, just days after twitch discloses a similar incident.",-0.4019,Negative,-0.4019,Negative
The Home Depot,2014-11-06,home depot says hackers also stole email addresses,"hackers took 53 million email addresses in addition to the payment card details of 56 million of its customers during this year's data breach, the retailer disclosed.",0.0,Neutral,0.0,Neutral
The Home Depot,2014-09-08,twitter begins testing a 'buy' button for instant purchases by its users,"the feature will allow users to buy products with a couple of clicks, and it comes after facebook began testing a similar button in july.",0.0,Neutral,0.2263,Positive
The Home Depot,2014-02-15,a list of favorites from a man who knows his apps,"we all have that friend who knows which new song you should buy, or the new movie you should watch, but what about that friend who knows about apps? meet michael galpert, the app know-it-all.",0.4215,Positive,0.7506,Very Positive
The Home Depot,2013-06-05,start-up to connect home appliances,"most makers of light switches, thermostats and other household appliances don't have the expertise to build the internet into their devices, nor can they afford adding a lot technology that significantly balloons the price of their products.",0.0,Neutral,0.0,Neutral
The Home Depot,2012-09-05,smartphone? presto! 2-way radio,this new variation on electronic communication is quietly winning over millions of mobile device users.,0.0,Neutral,0.5267,Positive
The Home Depot,2012-01-18,"before tearing out a wall, check your phone","with home improvement apps for mobile devices, a user can get cost estimates and how-to videos, as well as a 3-d picture of the final results before work even begins.",0.0,Neutral,0.6249,Very Positive
The Home Depot,2009-12-16,times square goes a tweeting,social networking comes to the times square new year's eve celebrations. so do more energy-efficient led lights.,0.0,Neutral,0.0,Neutral
The Home Depot,2008-11-19,black friday calls for a strategy session,"with retailers desperate to increase sales and shoppers looking for even steeper discounts, black friday 2008 is hoped by both parties to be, in the words of nigel tufnel of spinal tap, ""none more black.""",0.0,Neutral,0.6486,Very Positive
The Home Depot,2007-09-18,they lasted longer than airline meals did,the death of the paper airline ticket is finally at hand.,0.0,Neutral,-0.1779,Neutral
The Home Depot,2007-06-06,radio time to join list of ebay items up for auction,"the auction giant said it would begin selling radio airtime to advertisers, expanding into a business that google entered last year.",0.296,Positive,0.0,Neutral
The Home Depot,2006-05-20,"never mind the clip-on ties, geek squad can fix your pc",robert stephens has made a very good living solving the problems of technophobes and people who thought they were technically adept.,-0.2023,Negative,0.4865,Positive
Honeywell,2016-11-03,google home vs. amazon echo: a face-off of smart speakers,"which is a better helper, google home or amazon echo? a side-by-side test for six days revealed strengths and weaknesses.",0.5267,Positive,0.7351,Very Positive
Honeywell,2015-12-26,"jet.com's strategy: low prices, fast delivery, happy workers","the start-up's founder and chief says happiness, in particular the happiness of his employees, will separate his company from ventures that have failed.",0.3818,Positive,0.5994,Positive
Honeywell,2012-04-10,"one on one: asheem chandna, venture capitalist","asheem chandna, a partner at greylock partners, is a board member at imperva and palo alto networks and an investor in more than a dozen security-focused start-ups. he talks about how the nature of the cybersecurity threat is changing and what opportunities lie ahead.",0.0,Neutral,-0.2023,Negative
Honeywell,2007-09-16,"while in the kitchen, stir the stew and surf the web","dream kitchens may soon include a computer along with the latest refrigerator or oven, so people can satisfy their digital needs along with nutritional ones.",0.0,Neutral,0.6444,Very Positive
IBM,2016-12-29,how china built 'iphone city' with billions in perks for apple's partner,"a hidden bounty of benefits for foxconn's plant in zhengzhou, the world's biggest iphone factory, is central to the production of apple's most profitable product.",0.0,Neutral,0.6997,Very Positive
IBM,2016-11-20,microsoft spends big to build a computer out of science fiction,"the computer giant says it's ready to start planning a prototype quantum computer, a superpowerful device that relies on subatomic particles instead of transistors.",0.0,Neutral,0.3612,Positive
IBM,2016-09-18,artificial intelligence software is booming. but why now?,"as g.e., oracle, salesforce.com and others push their a.i. products, it remains unclear whether potential customers understand how they will profit.",0.2617,Positive,0.2263,Positive
IBM,2016-06-27,tech makes its pitch to the education community,"apple and dell, longtime rivals in the battle over sales to educators and students, now have plenty of company from companies like amazon and others.",0.0,Neutral,0.1531,Neutral
IBM,2016-04-21,apple services shut down in china in startling about-face,"the ibooks store and itunes movies were closed six months after they began in china, which had been more welcoming of apple than other tech companies.",0.0772,Neutral,0.4927,Positive
IBM,2016-03-06,taking baby steps toward software that reasons like humans,a number of start-ups are developing a new generation of pattern recognition software that is slowly and steadily advancing artificial intelligence.,0.3612,Positive,0.5267,Positive
IBM,2016-02-04,concern grows in u.s. over china's drive to make chips,chips with military as well as electronics uses came under focus when washington officials killed a $2.9 billion chinese investment.,0.0,Neutral,-0.5267,Negative
IBM,2015-12-09,"video feature: apps, like elves, help make the season bright","apps for creating animated video, thinking of gift ideas, organizing lists, tracking santa and donating to charities.",0.7964,Very Positive,0.8074,Very Positive
IBM,2015-11-06,toyota invests $1 billion in artificial intelligence in u.s.,"the initiative, the toyota research institute, will create one of the biggest labs in silicon valley and will be led by the roboticist gill pratt.",0.4767,Positive,0.2732,Positive
IBM,2015-10-20,daily report: ibm and yahoo in the hot seats,"ibm and yahoo are in the hot seat this week as both companies seek to rev up their growth. ibm, which reported results on monday, posted falling sales. next up is yahoo.",0.0,Neutral,0.25,Positive
IBM,2015-09-29,"tim cook, apple's chief, speaks on civic duty","timothy d. cook, apple's chief executive, discussed civic duty, environment and selling to businesses at an event on tuesday.",0.0,Neutral,0.0,Neutral
IBM,2015-08-18,pivotal software gets a new leader and announces strong cloud revenue,"paul maritz is stepping aside as chief executive of pivotal software. pivotal, the cloud-computing spinoff of emc, also announced strong growth in cloud subscriptions.",0.5106,Positive,0.7096,Very Positive
IBM,2015-07-21,"daily report: ibm revenue falls, highlighting challenges as it shifts course","the technology company, which does most of its business overseas, said most of the decline in the second quarter was because of the strong dollar.",0.0772,Neutral,0.5106,Positive
IBM,2015-06-15,ibm invests to help open-source big data software -- and itself,"ibm plans to invest heavily in accelerating the adoption of the open-source big data software, spark. with the move, ibm is investing as much in its own future as in the open-source project.",0.4019,Positive,0.2263,Positive
IBM,2015-04-23,"with amazon atop the cloud, big tech rivals are giving chase","amazon said in its first-quarter earnings report that its cloud division, amazon web services, had revenue of $1.57 billion and operating income of $265 million.",0.4767,Positive,0.34,Positive
IBM,2015-04-07,hp comes to terms with the cloud,"hewlett-packard has decided it cannot compete with the likes of amazon and google for one of the hottest new businesses. instead, on the eve of its split into two companies, hp is learning about collaborative technologies, and not just for its customers.",0.0,Neutral,0.5423,Positive
IBM,2015-02-25,"vivek wadhwa, voice for women in silicon valley, is foiled by his tone",mr. wadhwa was one of the loudest male voices pushing for gender diversity in silicon valley. his story is a lesson in how not to handle criticism.,0.0,Neutral,0.3412,Positive
IBM,2015-01-28,amazon's got mail,amazon's latest foray: back-end email systems.,0.0,Neutral,0.0,Neutral
IBM,2014-11-16,amazon moves to extend cloud-computing dominance,"amazon web services already has the largest share of the worldwide cloud-computing market, and is looking for ways to expand the range of services it offers.",0.4939,Positive,0.6369,Very Positive
IBM,2014-10-15,"apple to unveil new ipads, as rivals gain ground","the announcement of the tablets, which are expected to have significant upgrades, is coming as sales have slowed and competition has toughened.",0.5267,Positive,0.2263,Positive
IBM,2014-09-28,the google formula for success,"the key to success in modern business is hiring and nurturing ""smart creatives,"" according to a new book co-authored by eric schmidt, former chief executive of google.",0.5719,Positive,0.8555,Very Positive
IBM,2014-08-11,"'beep,' says the bellhop","the aloft hotel in cupertino, calif., will begin testing a robot designed to shuttle items from the hotel lobby desk to guest rooms.",0.0,Neutral,0.0258,Neutral
IBM,2014-07-15,apple joins with ibm on business software,"the two companies have been working on more than 100 software programs developed for apple's ios operating system, tailoring them for use in industries.",0.0,Neutral,0.0,Neutral
IBM,2014-06-11,intelligence too big for a single machine,"a surge in data and software to find patterns in it, and advances in storage and communication, have transformed the computing industry.",0.4767,Positive,0.0,Neutral
IBM,2014-04-24,companies back initiative to support openssl and other open-source projects,the heartlbleed bug that weakened the security of millions of web servers and internet-connected devices also exposed a flaw in open-source software maintenance that many have promised to fix.,0.4019,Positive,0.3182,Positive
IBM,2014-03-28,blackberry sees hope for future in security,"blackberry has had relentlessly bad financial news, but analysts are no longer raising concerns that the company is rapidly heading toward collapse.",0.6486,Very Positive,-0.8537,Very Negative
IBM,2014-02-15,intel's sharp-eyed social scientist,"as part of intel's mission to be regarded as more than just a chip maker, the anthropologist genevieve bell leads a globe-trotting team that is trying to learn what people crave in their electronics.",0.0,Neutral,0.0,Neutral
IBM,2014-01-15,"today's scuttlebot: dorsey on disrupting receipts, and implications of the net neutrality ruling","wednesday's highlights from around the web include jack dorsey, while pitching his payments start-up, square, arguing that the receipt is an untapped ""canvas"" and ""publishing medium."" plus, why the network neutrality ruling on tuesday could matter to start-ups.",0.0,Neutral,-0.4404,Negative
IBM,2013-11-13,ibm to announce more powerful watson via the internet,"companies, academics and individual software developers will be able to use watson at a small fraction of the previous cost.",0.4754,Positive,0.0,Neutral
IBM,2013-10-13,privacy fears grow as cities increase surveillance,"a program in oakland, calif., is one of the latest and most contentious examples of cities using big data technology, and federal dollars, for routine law enforcement.",-0.128,Neutral,-0.3597,Negative
IBM,2013-08-26,daily report: tech upstarts consider their mortality,"the leaders of up-and-coming technology companies are pondering the lesson of microsoft and its departing chief, steven ballmer: that even an industry leader is likely be dethroned eventually.",0.0,Neutral,0.0,Neutral
IBM,2013-07-11,"microsoft overhauls, the apple way",the giant software company is creating four new divisions and reassigning nearly every senior executive as it tries to create timely products that consumers want.,0.0,Neutral,0.5574,Positive
IBM,2013-06-07,vince vaughn and owen wilson arrive in silicon valley,"when the stars of the comedy ""the internship"" arrived at google to shoot the movie, they were forced to adjust to some quirks of silicon valley culture.",0.0,Neutral,-0.4404,Negative
IBM,2013-04-29,amazon's boom in cloud partners,"amazon web services is in the middle of a worldwide tour, selling itself to customers and partners and gearing up for competition from a variety of new competitors.",0.0,Neutral,0.1779,Neutral
IBM,2013-04-04,a place where old computers go to live,"in the living computer museum, opened quietly last fall in seattle, paul allen has assembled systems you probably have never heard of -- unless you were a computer hacker in the 1960s or 1970s.",0.0,Neutral,0.0,Neutral
IBM,2013-02-28,"and now, from i.b.m., it's chef watson",i.b.m. is attempting to expand its artificial intelligence technology and turn its jeopardy-winning computer watson into something that actually makes commercial sense.,0.0,Neutral,0.6597,Very Positive
IBM,2013-01-25,silicon valley companies lobbying against europe's privacy proposals,a dispute has brought into the open how much europe and the united states differ on privacy rights and their role in the digital economy.,-0.0772,Neutral,0.0258,Neutral
Intel,2016-12-29,how china built 'iphone city' with billions in perks for apple's partner,"a hidden bounty of benefits for foxconn's plant in zhengzhou, the world's biggest iphone factory, is central to the production of apple's most profitable product.",0.0,Neutral,0.6997,Very Positive
Intel,2016-12-13,"when trump meets tech leaders, jobs will be on the agenda","the executives meeting with mr. trump in manhattan on wednesday include elon musk of tesla, timothy d. cook of apple and jeff bezos of amazon.",0.0,Neutral,0.1779,Neutral
Intel,2016-08-14,intel's new mission: find fresh uses for its famous paranoia,"the world's biggest semiconductor company is scrambling for a place in sensors, wireless networking and autonomous vehicles, as computing spreads to nearly every machine.",0.0772,Neutral,0.0,Neutral
Intel,2016-05-04,moore's law loses some true believers,an association of chip makers is signaling that the principle that has guided improvements in chip technology for decades may soon have run its course.,0.128,Neutral,0.3182,Positive
Intel,2016-04-19,"intel to cut 12,000 jobs as pc demand plummets","the company, the largest semiconductor maker, will lay off 11 percent of its work force as it shifts to supplying chips for phones and other devices.",-0.3818,Negative,0.0,Neutral
Intel,2016-02-22,facebook open sources wireless gear,the social networking giant wants virtual reality everywhere. that means getting hardware costs down.,0.0,Neutral,0.0,Neutral
Intel,2016-01-11,daily report: the tech news cycle is about to ramp up,an already busy start to the year for the tech sector is set to ramp up with the beginning of the tech earnings season this week.,0.0,Neutral,0.0,Neutral
Intel,2015-10-30,u.s. tech giants may blur national security boundaries in china deals,"a growing number of companies like ibm, cisco systems and microsoft have partnerships with chinese companies with ties to the military, and experts are questioning those links.",0.34,Positive,0.4767,Positive
Intel,2015-09-13,intelligence start-up goes behind enemy lines to get ahead of hackers,isight partners has assembled a team of expert analysts fluent in 24 languages to infiltrate the underground and prevent criminals from attacking its clients.,-0.1027,Neutral,-0.765,Very Negative
Intel,2015-07-30,"u.s. sets goal for faster supercomputers. much, much faster.",president obama announced an ambitious goal of creating an ultrafast machine that could enable breakthroughs in fields like medicine and astronomy.,0.0,Neutral,0.7783,Very Positive
Intel,2015-06-16,chip makers renew pleas to congress for trade bill,"american chip makers say that, without the trade deal, they will be squeezed out of the growing asian market for computer chips by competitors in countries like china.",0.0,Neutral,0.4939,Positive
Intel,2015-04-22,working with old office files on a new mac os,"even with an upgrade, there are several ways to work with microsoft office files. also, backing up data on an amazon fire tablet.",0.0,Neutral,-0.1531,Neutral
Intel,2015-03-15,"managers turn to computer games, aiming for more efficient employees",betterworks is part of a growing office software niche that aims to whip workers into shape through compulsory competition and public scoring.,0.4754,Positive,0.1779,Neutral
